{"perf":{"world_time":4321.5},"server":{"name":"Contract Test Server","version":"0.10.0.9.32","invite_code":"abc123ef","password_protected":false,"game_port":27315,"game":"Windrose","windrose_plus":"9.9.9-contract","max_players":8,"player_count":2},"multipliers":{"craft_efficiency":1,"craft_cost":1,"crop_speed":1,"xp":2,"loot":1.5,"harvest_yield":1,"stack_size":1,"inventory_size":1,"cooking_speed":2,"weight":1},"players":[{"display_name":"Jörg","name":"Jörg","player_id":101,"actor_id":"BP_R5Character_C_101","z":150,"y":-34000.25,"alive":true,"session_id":"player:101","x":12000.5},{"display_name":"Ana","name":"Ana","player_id":102,"actor_id":"BP_R5Character_C_102","z":210.75,"y":8000,"alive":true,"session_id":"player:102","x":-5000}],"timestamp":1793042428}